<?xml version="1.0" encoding="UTF-8"?>
<config xmlns:xsi="http://www.w3.org/2001/XMLSchema-instance"
	xsi:noNamespaceSchemaLocation="ioc.xsd">
	<beans>
		<bean name="druid" class="com.alibaba.druid.pool.DruidDataSource">
			<property name="url" value="${db.url}" />
			<property name="username" value="${db.username}" />
			<property name="password" value="${db.password}" />
		</bean>
		<bean class="li.aop.Account">
			<property name="dataSource" />
		</bean>
	</beans>
</config>